{"name":"zagrosi-forge","version":"0.2.0","description":"Fixture plugin","author":{"name":"Zagrosi","url":"https://github.com/zagrosi-code"},"homepage":"https://github.com/zagrosi-code/zagrosi-forge","repository":"https://github.com/zagrosi-code/zagrosi-forge","license":"MIT","keywords":["codex","planning","tdd"],"skills":"./skills/","scripts":"./scripts/","interface":{"displayName":"Zagrosi Forge","shortDescription":"Fixture","longDescription":"Fixture for canonical bundle tests.","developerName":"Zagrosi","category":"Coding","capabilities":["Interactive","Write"],"composerIcon":"./assets/icon.svg","websiteURL":"https://github.com/zagrosi-code/zagrosi-forge","privacyPolicyURL":"https://github.com/zagrosi-code/zagrosi-forge","termsOfServiceURL":"https://github.com/zagrosi-code/zagrosi-forge","defaultPrompt":["Use project","Use plan","Use implement"],"brandColor":"#0F766E","screenshots":["./assets/readme-hero.svg","./assets/readme-workflow.svg"]}}
